{
  "_meta": {
    "schema": "shrf-corpus-v1",
    "source": "Baseline-12 canonical index + branch files",
    "canonical_doi": "10.5281/zenodo.18899474",
    "generated_from": "shrf-corpus-orchestration skill",
    "renderer_rule": "This file is source of truth. Visual topology is a projection only. Corpus truth lives here.",
    "last_updated": "2026-05-08",
    "version": "0.4-populated"
  },

  "nodes": [
    {
      "id": "usdop",
      "doi": "10.5281/zenodo.18721255",
      "title": "USDOP v1.2",
      "short": "USDOP",
      "tier": "T0",
      "layer": "METHOD",
      "branch": "SPINE",
      "state": "VERIFIED",
      "confidence": "CANONICAL",
      "status": "foundational",
      "baseline12": true,
      "baseline12_node": 1,
      "angle_hint": 270,
      "radius_hint": 0.15,
      "description": "Unified Sequential Discipline Operating Protocol. Foundational method layer.",
      "open_gaps": [],
      "falsifiers": []
    },
    {
      "id": "shrf",
      "doi": "10.5281/zenodo.18761638",
      "title": "SHRF v2",
      "short": "SHRF",
      "tier": "T0",
      "layer": "FRAMEWORK",
      "branch": "SPINE",
      "state": "VERIFIED",
      "confidence": "CANONICAL",
      "status": "foundational",
      "baseline12": true,
      "baseline12_node": 2,
      "angle_hint": 270,
      "radius_hint": 0.28,
      "description": "Sympathetic Harmonic Resonance Framework v2. Core invariant: transitions governed by constraint structure at regime boundaries.",
      "open_gaps": [],
      "falsifiers": []
    },
    {
      "id": "iwc",
      "doi": "10.5281/zenodo.18764956",
      "title": "IWC",
      "short": "IWC",
      "tier": "T0",
      "layer": "FOUNDATION",
      "branch": "SPINE",
      "state": "VERIFIED",
      "confidence": "CANONICAL",
      "status": "foundational",
      "baseline12": true,
      "baseline12_node": 3,
      "angle_hint": 270,
      "radius_hint": 0.42,
      "description": "Invariant Working Concept. Foundation vertex. Four-vertex architecture anchor.",
      "open_gaps": [],
      "falsifiers": []
    },
    {
      "id": "tf-note1",
      "doi": "10.5281/zenodo.18906111",
      "title": "Toroidal-Fermi Note 1 — Model",
      "short": "TF-N1",
      "tier": "T1",
      "layer": "BRANCH",
      "branch": "TOROIDAL-FERMI",
      "state": "VERIFIED",
      "confidence": "CANONICAL",
      "status": "archived-theory-complete",
      "baseline12": false,
      "baseline12_pending": true,
      "angle_hint": 330,
      "radius_hint": 0.45,
      "description": "Toroidal-Fermi model. Defines r_total factorisation and r_T cosmological residual.",
      "surviving_condition": { "L_Gpc": 1, "nu_GHz_min": 10, "nu_GHz_max": 15, "scaling": "eps(nu) ~ nu^(-6/5)" },
      "open_gaps": ["empirical nu^(-6/5) confirmation", "plasma subtraction adequacy"],
      "falsifiers": ["F-TF-1", "F-TF-2", "F-TF-3"]
    },
    {
      "id": "tf-note2",
      "doi": "10.5281/zenodo.18906757",
      "title": "Toroidal-Fermi Note 2 — Coupling Bounds",
      "short": "TF-N2",
      "tier": "T1",
      "layer": "BRANCH",
      "branch": "TOROIDAL-FERMI",
      "state": "VERIFIED",
      "confidence": "CANONICAL",
      "status": "archived-theory-complete",
      "baseline12": false,
      "baseline12_pending": true,
      "angle_hint": 330,
      "radius_hint": 0.62,
      "description": "Coupling bounds for Toroidal-Fermi model. Defines eps_min detection threshold.",
      "open_gaps": ["r_source characterisation"],
      "falsifiers": ["F-TF-4"]
    },
    {
      "id": "tf-note3",
      "doi": "10.5281/zenodo.18906997",
      "title": "Toroidal-Fermi Note 3 — Frequency Test",
      "short": "TF-N3",
      "tier": "T1",
      "layer": "BRANCH",
      "branch": "TOROIDAL-FERMI",
      "state": "VERIFIED",
      "confidence": "CANONICAL",
      "status": "archived-theory-complete",
      "preferred_cite": true,
      "version_of": "10.5281/zenodo.18906881",
      "baseline12": false,
      "baseline12_pending": true,
      "angle_hint": 330,
      "radius_hint": 0.78,
      "description": "Frequency test. Surviving window: L~1Gpc, nu~10-15GHz, eps(nu) proportional nu^(-6/5). v2 preferred cite.",
      "open_gaps": ["FRB multi-frequency coherence statistics (primary test surface)"],
      "falsifiers": ["F-TF-1", "F-TF-2", "F-TF-3"]
    },
    {
      "id": "phys-cav",
      "doi": "10.5281/zenodo.18919458",
      "title": "PHYS-CAV: Cavity-Altered Superconductivity",
      "short": "PHYS-CAV",
      "tier": "T2",
      "layer": "BRANCH",
      "branch": "PHYS-CAV",
      "state": "INFERRED",
      "trident_gate": "G4_CONDITIONAL_PASS",
      "confidence": "CANONICAL",
      "status": "candidate",
      "baseline12": true,
      "baseline12_node": 4,
      "angle_hint": 30,
      "radius_hint": 0.55,
      "description": "Cavity-altered superconductivity. Electromagnetic boundary regime. Keren et al. Nature 2026.",
      "open_gaps": ["boundary geometry specificity", "coupling strength range"],
      "falsifiers": ["F-CAV-1", "F-CAV-2"]
    },
    {
      "id": "eco-gut",
      "doi": "10.5281/zenodo.18913066",
      "title": "ECO: Spatial Transcriptomics Gut Microbiome",
      "short": "ECO-GUT",
      "tier": "T2",
      "layer": "BRANCH",
      "branch": "ECO-GUT",
      "state": "INFERRED",
      "confidence": "CANONICAL",
      "status": "candidate",
      "baseline12": true,
      "baseline12_node": 5,
      "angle_hint": 60,
      "radius_hint": 0.50,
      "description": "Spatial transcriptomics gut microbiome. z≈0.47, f≈0.06. Ntekas et al. 2026.",
      "open_gaps": ["overlap proxy validation", "MED relevance threshold"],
      "falsifiers": ["F-ECO-1", "F-ECO-2"]
    },
    {
      "id": "pal5-bh",
      "doi": "10.5281/zenodo.18730275",
      "title": "CathedralEngine: PAL5-BH",
      "short": "PAL5-BH",
      "tier": "T2",
      "layer": "BRANCH",
      "branch": "CATHEDRAL-ENGINE",
      "state": "VERIFIED",
      "confidence": "CANONICAL",
      "status": "published",
      "baseline12": true,
      "baseline12_node": 6,
      "angle_hint": 150,
      "radius_hint": 0.45,
      "description": "CathedralEngine SHRF application: PAL5 stellar stream and black hole interaction.",
      "open_gaps": [],
      "falsifiers": []
    },
    {
      "id": "cosmic-bire-engine",
      "doi": "10.5281/zenodo.18732885",
      "title": "CathedralEngine: Cosmic Birefringence",
      "short": "BIRE-ENG",
      "tier": "T2",
      "layer": "BRANCH",
      "branch": "CATHEDRAL-ENGINE",
      "state": "VERIFIED",
      "confidence": "CANONICAL",
      "status": "published",
      "baseline12": true,
      "baseline12_node": 7,
      "angle_hint": 150,
      "radius_hint": 0.58,
      "description": "CathedralEngine: Cosmic birefringence application.",
      "open_gaps": [],
      "falsifiers": []
    },
    {
      "id": "psychiatry-li",
      "doi": "10.5281/zenodo.18733545",
      "title": "CathedralEngine: Systems Psychiatry / Lithium",
      "short": "PSYCH-LI",
      "tier": "T2",
      "layer": "BRANCH",
      "branch": "CATHEDRAL-ENGINE",
      "state": "VERIFIED",
      "confidence": "CANONICAL",
      "status": "published",
      "baseline12": true,
      "baseline12_node": 8,
      "angle_hint": 150,
      "radius_hint": 0.70,
      "description": "CathedralEngine: Systems psychiatry, lithium stabilisation mechanisms.",
      "open_gaps": [],
      "falsifiers": []
    },
    {
      "id": "impedance-collapse",
      "doi": "10.5281/zenodo.18792995",
      "title": "Impedance Collapse (Dryland/Rainforest)",
      "short": "IMP-COL",
      "tier": "T2",
      "layer": "BRANCH",
      "branch": "GEO-ECO",
      "state": "VERIFIED",
      "confidence": "CANONICAL",
      "status": "published",
      "baseline12": true,
      "baseline12_node": 9,
      "angle_hint": 90,
      "radius_hint": 0.55,
      "description": "Impedance collapse framework. Dryland and rainforest biome transition boundary dynamics.",
      "open_gaps": [],
      "falsifiers": []
    },
    {
      "id": "cosmic-bire-1",
      "doi": "10.5281/zenodo.18794860",
      "title": "Cosmic Birefringence Case Card 1",
      "short": "BIRE-1",
      "tier": "T2",
      "layer": "BRANCH",
      "branch": "COSMIC-BIRE",
      "state": "VERIFIED",
      "confidence": "CANONICAL",
      "status": "published",
      "baseline12": true,
      "baseline12_node": 10,
      "angle_hint": 210,
      "radius_hint": 0.45,
      "description": "Cosmic birefringence case card 1.",
      "open_gaps": [],
      "falsifiers": []
    },
    {
      "id": "cosmic-bire-2",
      "doi": "10.5281/zenodo.18795046",
      "title": "Cosmic Birefringence Case Card 2",
      "short": "BIRE-2",
      "tier": "T2",
      "layer": "BRANCH",
      "branch": "COSMIC-BIRE",
      "state": "VERIFIED",
      "confidence": "CANONICAL",
      "status": "published",
      "baseline12": true,
      "baseline12_node": 11,
      "angle_hint": 210,
      "radius_hint": 0.58,
      "description": "Cosmic birefringence case card 2.",
      "open_gaps": [],
      "falsifiers": []
    },
    {
      "id": "gov-ai",
      "doi": "10.5281/zenodo.18884622",
      "title": "GOV-AI: Anthropic–Pentagon Structural Enforcement Gap",
      "short": "GOV-AI",
      "tier": "T2",
      "layer": "BRANCH",
      "branch": "GOV-AI",
      "state": "INFERRED",
      "confidence": "CANONICAL",
      "status": "published",
      "baseline12": true,
      "baseline12_node": 12,
      "angle_hint": 240,
      "radius_hint": 0.50,
      "description": "GOV-AI structural enforcement gap analysis.",
      "open_gaps": ["institutional monitoring ongoing"],
      "falsifiers": []
    },
    {
      "id": "spectral-geo",
      "doi": "10.5281/zenodo.19155025",
      "title": "Spectral Geometry Synthesis — Torus Topology",
      "short": "SPEC-GEO",
      "tier": "T1",
      "layer": "BRANCH",
      "branch": "SPECTRAL-GEO",
      "state": "VERIFIED",
      "confidence": "CANONICAL",